id,node_id,name,full_name,private,html_url,description,fork,url,forks_url,keys_url,collaborators_url,teams_url,hooks_url,issue_events_url,events_url,assignees_url,branches_url,tags_url,blobs_url,git_tags_url,git_refs_url,trees_url,statuses_url,languages_url,stargazers_url,contributors_url,subscribers_url,subscription_url,commits_url,git_commits_url,comments_url,issue_comment_url,contents_url,compare_url,merges_url,archive_url,downloads_url,issues_url,pulls_url,milestones_url,notifications_url,labels_url,releases_url,deployments_url,created_at,updated_at,pushed_at,git_url,ssh_url,clone_url,svn_url,homepage,size,stargazers_count,watchers_count,language,has_issues,has_projects,has_downloads,has_wiki,has_pages,has_discussions,forks_count,mirror_url,archived,disabled,open_issues_count,license,allow_forking,is_template,web_commit_signoff_required,topics,visibility,forks,open_issues,watchers,default_branch,score,owner.login,owner.id,owner.node_id,owner.avatar_url,owner.gravatar_id,owner.url,owner.html_url,owner.followers_url,owner.following_url,owner.gists_url,owner.starred_url,owner.subscriptions_url,owner.organizations_url,owner.repos_url,owner.events_url,owner.received_events_url,owner.type,owner.site_admin,permissions.admin,permissions.maintain,permissions.push,permissions.triage,permissions.pull,search_query,search_term,search_term_source,natural_language,search_type
152398831,MDEwOlJlcG9zaXRvcnkxNTIzOTg4MzE=,L-p-t-i-u-H-a-T-i-B-c-Ninh-Nhanh-G-n-Gi-R-,suachuadieuhoa/L-p-t-i-u-H-a-T-i-B-c-Ninh-Nhanh-G-n-Gi-R-,False,https://github.com/suachuadieuhoa/L-p-t-i-u-H-a-T-i-B-c-Ninh-Nhanh-G-n-Gi-R-,"Lắp đặt điều hòa tại Bắc Ninh trọn gói giá rẻ cạnh tranh Công ty TNHH cơ điện lạnh Bắc Ninh là trung tâm cung cấp các dịch vụ lắp đặt tất cả các loại điều hòa và các dịch vụ kèm theo khác uy tín bậc nhất tại Bắc Ninh hiện nay. chúng tôi với độ ngũ kỹ thuật viên chuyên nghiệp với số lượng nhân viên khủng luôn sẵn sàng ở bất cứ khi nào. Bất cứ khu vực nào tại Bắc Ninh, Dù là đợt cao điểm hay những ngày thường, bạn sẽ không phải đợi quá 30p sau khi gọi điện cho chúng tôi. Với hàng ngàn lượt phục vụ mỗi năm tại Bắc Ninh chúng tôi tự tin mang đến cho bạn sự phục vụ tốt nhất.    Các bước lắp đặt điều hòa của công ty TNHH Bắc Ninh tại Bắc Ninh: Bước 1: Nhân tại công ty tiếp nhận cuộc gọi của khác hàng, hẹn giờ và báo thợ.  Bước 2: Nhân viên lắp đặt điều hòa sẽ đến tận nhà để khảo sát và tư vấn vị trí lắp đặt phù hợp, đảm bảo đạt đủ các điều kiện.  Bước 3: nhân viên kỹ thuật lên bản vẽ và xin cấp trên duyệt.  Sau khi đã tư vấn cho khách hàng, nhân viên sẽ báo giá cùng phương án thi công, lắp đặt điều hòa phù hợp nhất với căn nhà.  Bước 4: Khách hàng chấp nhận giá cả và phương án thi công thì tiến hành tháo và lắp đặt, vận hành chạy điều hòa. Hướng dẫn cách sử dụng, vận hành máy và bàn giao lại cho khách hàng.  Bước 5: Nhân viên sẽ ghi phiếu bảo hành cùng chế độ hậu mãi sau khi lắp đặt máy điều hòa. Nếu trong quá trình lắp có thay thế hay mua thêm linh kiện và khách hàng có nhu cầu viết hóa đơn thì thợ cũng sẽ thực hiện luôn.  Khi lắp đặt điều hòa, sẽ phát sinh một số chi phí từ những thiết bị sau: Máy điều hòa, ống đồng, băng cuốn, bảo ôn, dây điện, ống thoát nước, ông gió, ống máng bọc đường ống.. chúng tôi lưu ý trước cho quý khách hàng biết để chuẩn bị chi phí phù hợp và tránh bỡ ngỡ thanh toán.    Bắc ninh tập trung rất nhiều các khu công nghiệp, khu dân cư  và nhu cầu làm mát ở những khu này rất là cao. Nắm bắt được nhu cầu thiết yếu của người dân và các nhà máy xí nghiệp chúng tôi đã thành lập công ty cung cấp dịch vụ cơ điện lạnh tại Bắc Ninh. Ngoài lắp đặt điều hòa, chúng tôi còn cung cấp dịch vụ bảo trì, bảo dưỡng điều hòa, sửa chữa điều hòa, bảo dưỡng chiller, bảo dưỡng chiller…..vv.  Suốt một hành trình dài chúng tôi nhận được sự ủng hộ và tin tưởng từ phía khách hàng. Chúng tôi đã không làm cho khách hàng hối hận từ cách làm việc tới tác phong giao tiếp của thợ, tất cả đều chuyên nghiệp. Chúng tôi sẽ tiếp tục phát huy những ưu điểm này để các bạn nhận được sự phục vụ tốt nhất, hy vọng các bạn sẽ ủng hộ cho công ty chúng tôi.. Chúng tôi cam kết sẽ mang đến khách hàng những sản phẩm chính hãng với mức giá rẻ hợp lý cho người tiêu dùng. Hãy liên hệ với chúng tôi để được cung cấp sản phẩm tốt, dịch vụ lắp đặt điều hòa tại Bắc Ninh chất lượng cao, và có báo giá tốt nhất trên thị trường hiện nay.",False,https://api.github.com/repos/suachuadieuhoa/L-p-t-i-u-H-a-T-i-B-c-Ninh-Nhanh-G-n-Gi-R-,https://api.github.com/repos/suachuadieuhoa/L-p-t-i-u-H-a-T-i-B-c-Ninh-Nhanh-G-n-Gi-R-/forks,https://api.github.com/repos/suachuadieuhoa/L-p-t-i-u-H-a-T-i-B-c-Ninh-Nhanh-G-n-Gi-R-/keys{/key_id},https://api.github.com/repos/suachuadieuhoa/L-p-t-i-u-H-a-T-i-B-c-Ninh-Nhanh-G-n-Gi-R-/collaborators{/collaborator},https://api.github.com/repos/suachuadieuhoa/L-p-t-i-u-H-a-T-i-B-c-Ninh-Nhanh-G-n-Gi-R-/teams,https://api.github.com/repos/suachuadieuhoa/L-p-t-i-u-H-a-T-i-B-c-Ninh-Nhanh-G-n-Gi-R-/hooks,https://api.github.com/repos/suachuadieuhoa/L-p-t-i-u-H-a-T-i-B-c-Ninh-Nhanh-G-n-Gi-R-/issues/events{/number},https://api.github.com/repos/suachuadieuhoa/L-p-t-i-u-H-a-T-i-B-c-Ninh-Nhanh-G-n-Gi-R-/events,https://api.github.com/repos/suachuadieuhoa/L-p-t-i-u-H-a-T-i-B-c-Ninh-Nhanh-G-n-Gi-R-/assignees{/user},https://api.github.com/repos/suachuadieuhoa/L-p-t-i-u-H-a-T-i-B-c-Ninh-Nhanh-G-n-Gi-R-/branches{/branch},https://api.github.com/repos/suachuadieuhoa/L-p-t-i-u-H-a-T-i-B-c-Ninh-Nhanh-G-n-Gi-R-/tags,https://api.github.com/repos/suachuadieuhoa/L-p-t-i-u-H-a-T-i-B-c-Ninh-Nhanh-G-n-Gi-R-/git/blobs{/sha},https://api.github.com/repos/suachuadieuhoa/L-p-t-i-u-H-a-T-i-B-c-Ninh-Nhanh-G-n-Gi-R-/git/tags{/sha},https://api.github.com/repos/suachuadieuhoa/L-p-t-i-u-H-a-T-i-B-c-Ninh-Nhanh-G-n-Gi-R-/git/refs{/sha},https://api.github.com/repos/suachuadieuhoa/L-p-t-i-u-H-a-T-i-B-c-Ninh-Nhanh-G-n-Gi-R-/git/trees{/sha},https://api.github.com/repos/suachuadieuhoa/L-p-t-i-u-H-a-T-i-B-c-Ninh-Nhanh-G-n-Gi-R-/statuses/{sha},https://api.github.com/repos/suachuadieuhoa/L-p-t-i-u-H-a-T-i-B-c-Ninh-Nhanh-G-n-Gi-R-/languages,https://api.github.com/repos/suachuadieuhoa/L-p-t-i-u-H-a-T-i-B-c-Ninh-Nhanh-G-n-Gi-R-/stargazers,https://api.github.com/repos/suachuadieuhoa/L-p-t-i-u-H-a-T-i-B-c-Ninh-Nhanh-G-n-Gi-R-/contributors,https://api.github.com/repos/suachuadieuhoa/L-p-t-i-u-H-a-T-i-B-c-Ninh-Nhanh-G-n-Gi-R-/subscribers,https://api.github.com/repos/suachuadieuhoa/L-p-t-i-u-H-a-T-i-B-c-Ninh-Nhanh-G-n-Gi-R-/subscription,https://api.github.com/repos/suachuadieuhoa/L-p-t-i-u-H-a-T-i-B-c-Ninh-Nhanh-G-n-Gi-R-/commits{/sha},https://api.github.com/repos/suachuadieuhoa/L-p-t-i-u-H-a-T-i-B-c-Ninh-Nhanh-G-n-Gi-R-/git/commits{/sha},https://api.github.com/repos/suachuadieuhoa/L-p-t-i-u-H-a-T-i-B-c-Ninh-Nhanh-G-n-Gi-R-/comments{/number},https://api.github.com/repos/suachuadieuhoa/L-p-t-i-u-H-a-T-i-B-c-Ninh-Nhanh-G-n-Gi-R-/issues/comments{/number},https://api.github.com/repos/suachuadieuhoa/L-p-t-i-u-H-a-T-i-B-c-Ninh-Nhanh-G-n-Gi-R-/contents/{+path},https://api.github.com/repos/suachuadieuhoa/L-p-t-i-u-H-a-T-i-B-c-Ninh-Nhanh-G-n-Gi-R-/compare/{base}...{head},https://api.github.com/repos/suachuadieuhoa/L-p-t-i-u-H-a-T-i-B-c-Ninh-Nhanh-G-n-Gi-R-/merges,https://api.github.com/repos/suachuadieuhoa/L-p-t-i-u-H-a-T-i-B-c-Ninh-Nhanh-G-n-Gi-R-/{archive_format}{/ref},https://api.github.com/repos/suachuadieuhoa/L-p-t-i-u-H-a-T-i-B-c-Ninh-Nhanh-G-n-Gi-R-/downloads,https://api.github.com/repos/suachuadieuhoa/L-p-t-i-u-H-a-T-i-B-c-Ninh-Nhanh-G-n-Gi-R-/issues{/number},https://api.github.com/repos/suachuadieuhoa/L-p-t-i-u-H-a-T-i-B-c-Ninh-Nhanh-G-n-Gi-R-/pulls{/number},https://api.github.com/repos/suachuadieuhoa/L-p-t-i-u-H-a-T-i-B-c-Ninh-Nhanh-G-n-Gi-R-/milestones{/number},"https://api.github.com/repos/suachuadieuhoa/L-p-t-i-u-H-a-T-i-B-c-Ninh-Nhanh-G-n-Gi-R-/notifications{?since,all,participating}",https://api.github.com/repos/suachuadieuhoa/L-p-t-i-u-H-a-T-i-B-c-Ninh-Nhanh-G-n-Gi-R-/labels{/name},https://api.github.com/repos/suachuadieuhoa/L-p-t-i-u-H-a-T-i-B-c-Ninh-Nhanh-G-n-Gi-R-/releases{/id},https://api.github.com/repos/suachuadieuhoa/L-p-t-i-u-H-a-T-i-B-c-Ninh-Nhanh-G-n-Gi-R-/deployments,2018-10-10T09:37:13Z,2018-10-10T09:37:13Z,2018-10-10T09:37:13Z,git://github.com/suachuadieuhoa/L-p-t-i-u-H-a-T-i-B-c-Ninh-Nhanh-G-n-Gi-R-.git,git@github.com:suachuadieuhoa/L-p-t-i-u-H-a-T-i-B-c-Ninh-Nhanh-G-n-Gi-R-.git,https://github.com/suachuadieuhoa/L-p-t-i-u-H-a-T-i-B-c-Ninh-Nhanh-G-n-Gi-R-.git,https://github.com/suachuadieuhoa/L-p-t-i-u-H-a-T-i-B-c-Ninh-Nhanh-G-n-Gi-R-,,0,0,0,,True,True,True,True,False,False,0,,False,False,0,,True,False,False,[],public,0,0,0,master,1.0,suachuadieuhoa,44021906,MDQ6VXNlcjQ0MDIxOTA2,https://avatars.githubusercontent.com/u/44021906?v=4,,https://api.github.com/users/suachuadieuhoa,https://github.com/suachuadieuhoa,https://api.github.com/users/suachuadieuhoa/followers,https://api.github.com/users/suachuadieuhoa/following{/other_user},https://api.github.com/users/suachuadieuhoa/gists{/gist_id},https://api.github.com/users/suachuadieuhoa/starred{/owner}{/repo},https://api.github.com/users/suachuadieuhoa/subscriptions,https://api.github.com/users/suachuadieuhoa/orgs,https://api.github.com/users/suachuadieuhoa/repos,https://api.github.com/users/suachuadieuhoa/events{/privacy},https://api.github.com/users/suachuadieuhoa/received_events,User,False,False,False,False,False,True,https://api.github.com/search/repositories?q=Nhân+văn+kỹ+thuật+số&per_page=100&page=1,Nhân văn kỹ thuật số,Digital Humanities,vi,searched
171400726,MDEwOlJlcG9zaXRvcnkxNzE0MDA3MjY=,7-dia-chi-pha-thai-an-toan-o-ha-noi,anhai2559/7-dia-chi-pha-thai-an-toan-o-ha-noi,False,https://github.com/anhai2559/7-dia-chi-pha-thai-an-toan-o-ha-noi,"Phá thai an toàn là một trong những biện pháp đưa ra nhằm giúp chị em mang thai ngoài ý muốn thực hiện đình chỉ thai nghén, giảm thiểu những ảnh hưởng đến sức khỏe, khả năng sinh sản về sau này. Một trong những điều quyết định đến hiệu quả của phá thai an toàn đó chính là địa chỉ thực hiện. Dưới đây là 7 địa chỉ phá thai an toàn nhất tại Hà Nội hiện nay được nhiều chị em đánh giá cao.  Phá thai an toàn và những điều cần biết Phá thai an toàn thực tế là việc sử dụng các biện pháp trong y tế thực hiện chấm dứt sự phát triển của thai kỳ trong tử cung khi mang thai ngoài ý muốn. Và dù là lựa chọn kỹ thuật phá thai an toàn nào thì cũng bắt buộc chúng phải được thực hiện tại các cơ sở y tế, người thực hiện phải là các bác sĩ được đào tạo, có kỹ năng và kinh nghiệm thực hiện. Điều này góp phần giảm thiểu các nguy cơ sót thai, băng huyết, thủng tử cung, nhiễm trùng,… cho chị em khi thực hiện. Hiện có 2 phương pháp phá thai an toàn đó là: Phá thai bằng thuốc: sử dụng thuốc để phá thai dành cho thai phụ mang thai dưới 7 tuần, thai đã vào tử cung, không có tiền sử dị ứng thuốc, sử dụng coticoid toàn thân lâu ngày, bệnh tim mạch, rối loạn đông máu,… Phá thai ngoại khoa gồm nạo hút thai (6-12 tuần), nong và gắp thai (13 -18 tuần)  Nếu bạn có thắc mắc cần tư vấn. Liên hệ ngay với bác sĩ: Tại Đây!  7 địa chỉ phá thai an toàn tại Hà Nội hiện nay Hiện nay, có khá nhiều cơ sở y tế thực hiện phá thai an toàn, tuy nhiên, không phải chất lượng cơ sở y tế nào cũng như nhau. Tiêu chí để đánh giá địa chỉ phá thai an toàn bao gồm: Tính pháp lý: cơ sở phải được cấp phép, bác sĩ có giấy phép hành nghề, được phê duyệt danh mục kỹ thuật phá thai Điều kiện cơ sở vật chất kỹ thuật: cơ sở đảm bảo gồm phòng khám, phòng thủ thuật, dụng cụ y tế,…đảm bảo vô khuẩn, đầy đủ theo quy định. Thuốc, kỹ thuật thực hiện phá thai an toàn cần phải đảm bảo quy chuẩn. Trình độ bác sĩ:các bác sĩ được đào tạo, có kỹ năng, kinh nghiệm thực hiện phá thai an toàn. Chi phí hợp lý: chi phí phá thai công khai, minh bạch rõ rang Dịch vụ y tế tốt: thái độ phục vụ của nhân viên, thủ tục hành chính  Nếu bạn có thắc mắc cần tư vấn. Liên hệ ngay với bác sĩ: Tại Đây!  Theo đó, chị em có thể tham khảo top 7 địa chỉ phá thai an toàn nhất tại Hà Nội hiện nay. Danh sách được thống kê dựa trên những tiêu chí đánh giá của bệnh nhân   PHÒNG KHÁM ĐA KHOA QUỐC TẾ HÀ NỘI – 152 XÃ ĐÀN Địa chỉ phá thai an toàn ở đâu tốt nhất tại Hà Nội? Một gợi ý cho chị em đó là  Phòng khám đa khoa Quốc tế Hà Nội.   Đây là một trong những cơ sở y tế hội tụ trong mình đầy đủ ưu thế và tiêu chí của một cơ sở y tế chất lượng cao không thua kém gì các cơ sở tuyến trên. Phòng khám được nhiều chị em tin tưởng lựa chọn trong việc thăm khám phụ khoa, kế hoạch hóa gia đình, phá thai an toàn.  Phòng khám được Sở Y tế cấp phép hoạt động, mọi danh mục và các hoạt động thăm khám, điều trị trong đó có phá thai an toàn đều được phê duyệt. Ngoài ra, tại đây còn được đầu tư mạnh về hệ thống cơ sở vật chất, máy móc kỹ thuật phục vụ chẩn đoán, thực hiện an toàn, nhanh chóng và hiệu quả cao, phục hồi nhanh.  Sau phá thai, chị em còn được sử dụng các thiết bị phục hồi, thuốc Đông y giúp nuôi dưỡng hoạt động buồng trứng, nâng cao thể trạng,…từ đó đảm bảo giảm thiếu tối đa các tai biến, biến chứng trong và sau phá thai  Với những dịch vụ y tế đạt chuẩn quốc tế và làm hài lòng tất cả mọi người bệnh khi đến phòng khám, phòng khám là top địa chỉ phá thai an toàn nhất Hà Nội hiện nay.  Địa chỉ: 152 Xã Đàn, Đống Đa, Hà Nội Lịch làm việc: 8:00–20:30 tất cả các ngày trong tuần kể cả lễ tết SDT: 0969 668 152  Lưu ý: Với những bệnh nhân có mã số đặt hẹn khám trước, khi đến khám chữa bệnh tại phòng khám sẽ được GIẢM NGAY 100K chi phí khám ban đầu, được ưu tiên khám trước mà không phải chờ đợi lâu. Mọi thông tin về bệnh nhân được bảo mật tuyệt đối. Lấy mã số đặt hẹn khám trước: Tại Đây!  BỆNH VIỆN PHỤ SẢN TRUNG ƯƠNG – VIỆN C Phá thai an toàn  tại Bệnh viện phụ sản Trung Ương cũng là địa chỉ mà nhiều chị em tin tưởng lựa chọn vì đây là một cơ sở tuyến trung ương, bác sĩ giỏi. Tuy nhiên,  nếu lựa chọn quyết định phá thai an toàn tại đây nên đi cùng người thân để chủ động khâu thủ tục.  Bệnh viện là cơ sở y tế chuyên khoa sản phụ khoa tuyến trung ương nên hội tụ nhiều bác sĩ, tiến sĩ, giáo sư,…giỏi, các trang thiết bị y tế được đầu tư phục vụ tối đa nhu cầu của bệnh nhân trên cả nước   Địa chỉ: 43 Tràng Thi, Hàng Bông, Hoàn Kiếm, Hà Nội Lịch làm việc: Thứ Hai — Thứ Sáu: 07:30–16:30  Lưu ý: Vì là bệnh viện chuyên sản phụ khoa, không chỉ thực hiện phá thai an toàn mà còn thăm khám chữa trị các bệnh phụ khoa thông thường, phức tạp, sinh đẻ,…nên lượng bệnh nhân rất đông. Chị em cần đi sớm và đi cùng người thân để chủ động   Nếu bạn có thắc mắc cần tư vấn. Liên hệ ngay với bác sĩ: Tại Đây!",False,https://api.github.com/repos/anhai2559/7-dia-chi-pha-thai-an-toan-o-ha-noi,https://api.github.com/repos/anhai2559/7-dia-chi-pha-thai-an-toan-o-ha-noi/forks,https://api.github.com/repos/anhai2559/7-dia-chi-pha-thai-an-toan-o-ha-noi/keys{/key_id},https://api.github.com/repos/anhai2559/7-dia-chi-pha-thai-an-toan-o-ha-noi/collaborators{/collaborator},https://api.github.com/repos/anhai2559/7-dia-chi-pha-thai-an-toan-o-ha-noi/teams,https://api.github.com/repos/anhai2559/7-dia-chi-pha-thai-an-toan-o-ha-noi/hooks,https://api.github.com/repos/anhai2559/7-dia-chi-pha-thai-an-toan-o-ha-noi/issues/events{/number},https://api.github.com/repos/anhai2559/7-dia-chi-pha-thai-an-toan-o-ha-noi/events,https://api.github.com/repos/anhai2559/7-dia-chi-pha-thai-an-toan-o-ha-noi/assignees{/user},https://api.github.com/repos/anhai2559/7-dia-chi-pha-thai-an-toan-o-ha-noi/branches{/branch},https://api.github.com/repos/anhai2559/7-dia-chi-pha-thai-an-toan-o-ha-noi/tags,https://api.github.com/repos/anhai2559/7-dia-chi-pha-thai-an-toan-o-ha-noi/git/blobs{/sha},https://api.github.com/repos/anhai2559/7-dia-chi-pha-thai-an-toan-o-ha-noi/git/tags{/sha},https://api.github.com/repos/anhai2559/7-dia-chi-pha-thai-an-toan-o-ha-noi/git/refs{/sha},https://api.github.com/repos/anhai2559/7-dia-chi-pha-thai-an-toan-o-ha-noi/git/trees{/sha},https://api.github.com/repos/anhai2559/7-dia-chi-pha-thai-an-toan-o-ha-noi/statuses/{sha},https://api.github.com/repos/anhai2559/7-dia-chi-pha-thai-an-toan-o-ha-noi/languages,https://api.github.com/repos/anhai2559/7-dia-chi-pha-thai-an-toan-o-ha-noi/stargazers,https://api.github.com/repos/anhai2559/7-dia-chi-pha-thai-an-toan-o-ha-noi/contributors,https://api.github.com/repos/anhai2559/7-dia-chi-pha-thai-an-toan-o-ha-noi/subscribers,https://api.github.com/repos/anhai2559/7-dia-chi-pha-thai-an-toan-o-ha-noi/subscription,https://api.github.com/repos/anhai2559/7-dia-chi-pha-thai-an-toan-o-ha-noi/commits{/sha},https://api.github.com/repos/anhai2559/7-dia-chi-pha-thai-an-toan-o-ha-noi/git/commits{/sha},https://api.github.com/repos/anhai2559/7-dia-chi-pha-thai-an-toan-o-ha-noi/comments{/number},https://api.github.com/repos/anhai2559/7-dia-chi-pha-thai-an-toan-o-ha-noi/issues/comments{/number},https://api.github.com/repos/anhai2559/7-dia-chi-pha-thai-an-toan-o-ha-noi/contents/{+path},https://api.github.com/repos/anhai2559/7-dia-chi-pha-thai-an-toan-o-ha-noi/compare/{base}...{head},https://api.github.com/repos/anhai2559/7-dia-chi-pha-thai-an-toan-o-ha-noi/merges,https://api.github.com/repos/anhai2559/7-dia-chi-pha-thai-an-toan-o-ha-noi/{archive_format}{/ref},https://api.github.com/repos/anhai2559/7-dia-chi-pha-thai-an-toan-o-ha-noi/downloads,https://api.github.com/repos/anhai2559/7-dia-chi-pha-thai-an-toan-o-ha-noi/issues{/number},https://api.github.com/repos/anhai2559/7-dia-chi-pha-thai-an-toan-o-ha-noi/pulls{/number},https://api.github.com/repos/anhai2559/7-dia-chi-pha-thai-an-toan-o-ha-noi/milestones{/number},"https://api.github.com/repos/anhai2559/7-dia-chi-pha-thai-an-toan-o-ha-noi/notifications{?since,all,participating}",https://api.github.com/repos/anhai2559/7-dia-chi-pha-thai-an-toan-o-ha-noi/labels{/name},https://api.github.com/repos/anhai2559/7-dia-chi-pha-thai-an-toan-o-ha-noi/releases{/id},https://api.github.com/repos/anhai2559/7-dia-chi-pha-thai-an-toan-o-ha-noi/deployments,2019-02-19T03:46:44Z,2019-09-04T09:03:52Z,2019-02-19T03:48:49Z,git://github.com/anhai2559/7-dia-chi-pha-thai-an-toan-o-ha-noi.git,git@github.com:anhai2559/7-dia-chi-pha-thai-an-toan-o-ha-noi.git,https://github.com/anhai2559/7-dia-chi-pha-thai-an-toan-o-ha-noi.git,https://github.com/anhai2559/7-dia-chi-pha-thai-an-toan-o-ha-noi,,4,1,1,,True,True,True,True,False,False,0,,False,False,0,,True,False,False,[],public,0,0,1,master,1.0,anhai2559,46776639,MDQ6VXNlcjQ2Nzc2NjM5,https://avatars.githubusercontent.com/u/46776639?v=4,,https://api.github.com/users/anhai2559,https://github.com/anhai2559,https://api.github.com/users/anhai2559/followers,https://api.github.com/users/anhai2559/following{/other_user},https://api.github.com/users/anhai2559/gists{/gist_id},https://api.github.com/users/anhai2559/starred{/owner}{/repo},https://api.github.com/users/anhai2559/subscriptions,https://api.github.com/users/anhai2559/orgs,https://api.github.com/users/anhai2559/repos,https://api.github.com/users/anhai2559/events{/privacy},https://api.github.com/users/anhai2559/received_events,User,False,False,False,False,False,True,https://api.github.com/search/repositories?q=Nhân+văn+kỹ+thuật+số&per_page=100&page=1,Nhân văn kỹ thuật số,Digital Humanities,vi,searched
